{
  "schemaVersion": "0.9.0",
  "arenaModelId": "grougalorasalar-arena-canonical-0.9.0",
  "totalBoundaryCells": 50,
  "totalBoundaryEdges": 104,
  "boundaryCells": [
    {
      "id": 0,
      "stableId": "C000",
      "x": 1,
      "y": -12,
      "classification": "confirmed",
      "displayCategory": "confirmed_boundary_cell",
      "confidence": "high",
      "evidenceCriteria": {
        "user_boundary_annotation": false,
        "user_hidden_cell_annotation": true,
        "visible_empty_map": true,
        "parity_geometric_consistency": true
      },
      "evidenceCount": 3,
      "sourceAuthority": "user_hidden_cell_annotation",
      "positionCheck": {
        "sourceImage": "assets/reference/empty_arena.jpeg",
        "fitRegion": "right-top",
        "method": "regional_visible_grid_line_fit",
        "expectedCenter": {
          "x": 1493.0633,
          "y": 66.8143
        },
        "plausibleCenter": {
          "x": 1493.0633,
          "y": 66.8143
        },
        "delta": {
          "x": 0.0,
          "y": 0.0
        },
        "distancePixels": 0.0,
        "distanceCells": 0.0,
        "toleranceCells": 0.12,
        "outlier": false,
        "independentVisibleCellSurface": true
      },
      "reviewRequired": false,
      "reviewReasons": []
    },
    {
      "id": 1,
      "stableId": "C001",
      "x": 0,
      "y": -11,
      "classification": "confirmed",
      "displayCategory": "confirmed_boundary_cell",
      "confidence": "medium",
      "evidenceCriteria": {
        "user_boundary_annotation": false,
        "user_hidden_cell_annotation": false,
        "visible_empty_map": true,
        "parity_geometric_consistency": true
      },
      "evidenceCount": 2,
      "sourceAuthority": "visible_empty_map",
      "positionCheck": {
        "sourceImage": "assets/reference/empty_arena.jpeg",
        "fitRegion": "right-top",
        "method": "regional_visible_grid_line_fit",
        "expectedCenter": {
          "x": 1407.0901,
          "y": 66.8174
        },
        "plausibleCenter": {
          "x": 1407.0901,
          "y": 66.8174
        },
        "delta": {
          "x": 0.0,
          "y": 0.0
        },
        "distancePixels": 0.0,
        "distanceCells": 0.0,
        "toleranceCells": 0.12,
        "outlier": false,
        "independentVisibleCellSurface": true
      },
      "reviewRequired": false,
      "reviewReasons": []
    },
    {
      "id": 3,
      "stableId": "C003",
      "x": 2,
      "y": -11,
      "classification": "confirmed",
      "displayCategory": "confirmed_boundary_cell",
      "confidence": "high",
      "evidenceCriteria": {
        "user_boundary_annotation": false,
        "user_hidden_cell_annotation": true,
        "visible_empty_map": true,
        "parity_geometric_consistency": true
      },
      "evidenceCount": 3,
      "sourceAuthority": "user_hidden_cell_annotation",
      "positionCheck": {
        "sourceImage": "assets/reference/empty_arena.jpeg",
        "fitRegion": "right-top",
        "method": "regional_visible_grid_line_fit",
        "expectedCenter": {
          "x": 1493.0648,
          "y": 109.8009
        },
        "plausibleCenter": {
          "x": 1493.0648,
          "y": 109.8009
        },
        "delta": {
          "x": 0.0,
          "y": 0.0
        },
        "distancePixels": 0.0,
        "distanceCells": 0.0,
        "toleranceCells": 0.12,
        "outlier": false,
        "independentVisibleCellSurface": true
      },
      "reviewRequired": false,
      "reviewReasons": []
    },
    {
      "id": 4,
      "stableId": "C004",
      "x": -1,
      "y": -10,
      "classification": "confirmed",
      "displayCategory": "confirmed_boundary_cell",
      "confidence": "medium",
      "evidenceCriteria": {
        "user_boundary_annotation": false,
        "user_hidden_cell_annotation": false,
        "visible_empty_map": true,
        "parity_geometric_consistency": true
      },
      "evidenceCount": 2,
      "sourceAuthority": "visible_empty_map",
      "positionCheck": {
        "sourceImage": "assets/reference/empty_arena.jpeg",
        "fitRegion": "right-top",
        "method": "regional_visible_grid_line_fit",
        "expectedCenter": {
          "x": 1321.1169,
          "y": 66.8206
        },
        "plausibleCenter": {
          "x": 1321.1169,
          "y": 66.8206
        },
        "delta": {
          "x": 0.0,
          "y": 0.0
        },
        "distancePixels": 0.0,
        "distanceCells": 0.0,
        "toleranceCells": 0.12,
        "outlier": false,
        "independentVisibleCellSurface": true
      },
      "reviewRequired": false,
      "reviewReasons": []
    },
    {
      "id": 8,
      "stableId": "C008",
      "x": 3,
      "y": -10,
      "classification": "confirmed",
      "displayCategory": "confirmed_boundary_cell",
      "confidence": "medium",
      "evidenceCriteria": {
        "user_boundary_annotation": false,
        "user_hidden_cell_annotation": true,
        "visible_empty_map": false,
        "parity_geometric_consistency": true
      },
      "evidenceCount": 2,
      "sourceAuthority": "user_hidden_cell_annotation",
      "positionCheck": {
        "sourceImage": "assets/reference/empty_arena.jpeg",
        "fitRegion": "right-top",
        "method": "regional_visible_grid_line_fit",
        "expectedCenter": {
          "x": 1493.0664,
          "y": 152.7875
        },
        "plausibleCenter": {
          "x": 1493.0664,
          "y": 152.7875
        },
        "delta": {
          "x": 0.0,
          "y": 0.0
        },
        "distancePixels": 0.0,
        "distanceCells": 0.0,
        "toleranceCells": 0.12,
        "outlier": false,
        "independentVisibleCellSurface": false
      },
      "reviewRequired": false,
      "reviewReasons": []
    },
    {
      "id": 9,
      "stableId": "C009",
      "x": -2,
      "y": -9,
      "classification": "unresolved",
      "displayCategory": "geometric_inference_unresolved",
      "confidence": "low",
      "evidenceCriteria": {
        "user_boundary_annotation": false,
        "user_hidden_cell_annotation": false,
        "visible_empty_map": false,
        "parity_geometric_consistency": true
      },
      "evidenceCount": 1,
      "sourceAuthority": "unresolved",
      "positionCheck": {
        "sourceImage": "assets/reference/empty_arena.jpeg",
        "fitRegion": "right-top",
        "method": "regional_visible_grid_line_fit",
        "expectedCenter": {
          "x": 1235.1437,
          "y": 66.8237
        },
        "plausibleCenter": {
          "x": 1235.1437,
          "y": 66.8237
        },
        "delta": {
          "x": 0.0,
          "y": 0.0
        },
        "distancePixels": 0.0,
        "distanceCells": 0.0,
        "toleranceCells": 0.12,
        "outlier": false,
        "independentVisibleCellSurface": false
      },
      "reviewRequired": true,
      "reviewReasons": [
        "fewer_than_two_required_boundary_evidence_criteria"
      ]
    },
    {
      "id": 15,
      "stableId": "C015",
      "x": 4,
      "y": -9,
      "classification": "confirmed",
      "displayCategory": "confirmed_boundary_cell",
      "confidence": "medium",
      "evidenceCriteria": {
        "user_boundary_annotation": false,
        "user_hidden_cell_annotation": true,
        "visible_empty_map": false,
        "parity_geometric_consistency": true
      },
      "evidenceCount": 2,
      "sourceAuthority": "user_hidden_cell_annotation",
      "positionCheck": {
        "sourceImage": "assets/reference/empty_arena.jpeg",
        "fitRegion": "right-top",
        "method": "regional_visible_grid_line_fit",
        "expectedCenter": {
          "x": 1493.068,
          "y": 195.7741
        },
        "plausibleCenter": {
          "x": 1493.068,
          "y": 195.7741
        },
        "delta": {
          "x": 0.0,
          "y": 0.0
        },
        "distancePixels": 0.0,
        "distanceCells": 0.0,
        "toleranceCells": 0.12,
        "outlier": false,
        "independentVisibleCellSurface": false
      },
      "reviewRequired": false,
      "reviewReasons": []
    },
    {
      "id": 16,
      "stableId": "C016",
      "x": -3,
      "y": -8,
      "classification": "unresolved",
      "displayCategory": "geometric_inference_unresolved",
      "confidence": "low",
      "evidenceCriteria": {
        "user_boundary_annotation": false,
        "user_hidden_cell_annotation": false,
        "visible_empty_map": false,
        "parity_geometric_consistency": true
      },
      "evidenceCount": 1,
      "sourceAuthority": "unresolved",
      "positionCheck": {
        "sourceImage": "assets/reference/empty_arena.jpeg",
        "fitRegion": "right-top",
        "method": "regional_visible_grid_line_fit",
        "expectedCenter": {
          "x": 1149.1705,
          "y": 66.8269
        },
        "plausibleCenter": {
          "x": 1149.1705,
          "y": 66.8269
        },
        "delta": {
          "x": 0.0,
          "y": 0.0
        },
        "distancePixels": 0.0,
        "distanceCells": 0.0,
        "toleranceCells": 0.12,
        "outlier": false,
        "independentVisibleCellSurface": false
      },
      "reviewRequired": true,
      "reviewReasons": [
        "fewer_than_two_required_boundary_evidence_criteria"
      ]
    },
    {
      "id": 24,
      "stableId": "C024",
      "x": 5,
      "y": -8,
      "classification": "confirmed",
      "displayCategory": "confirmed_boundary_cell",
      "confidence": "high",
      "evidenceCriteria": {
        "user_boundary_annotation": false,
        "user_hidden_cell_annotation": true,
        "visible_empty_map": true,
        "parity_geometric_consistency": true
      },
      "evidenceCount": 3,
      "sourceAuthority": "user_hidden_cell_annotation",
      "positionCheck": {
        "sourceImage": "assets/reference/empty_arena.jpeg",
        "fitRegion": "right-top",